{"$schema":"https://json-schema.org/draft/2020-12/schema","additionalProperties":true,"properties":{"agent":{"type":"object"},"computed":{"additionalProperties":true,"properties":{"freshness_state":{"enum":["good","stale","faulty","blocked"]},"good_ratio":{"maximum":1,"minimum":0,"type":["number","null"]},"holes_count":{"minimum":0,"type":"integer"},"holes_ratio":{"maximum":1,"minimum":0,"type":["number","null"]},"inputs_hash":{"type":["string","null"]},"last_checked_at":{"type":["string","null"]},"matrix":{"items":{"additionalProperties":true,"properties":{"code_hash_sha256":{"type":["string","null"]},"ctx_kind":{"type":["string","null"]},"ctx_path":{"type":"string"},"ctx_semantic_hash_sha256":{"type":["string","null"]},"freshness_state":{"type":["string","null"]},"subtree_hash_sha256":{"type":["string","null"]}},"required":["ctx_path"],"type":"object"},"type":"array"},"staleness_reasons":{"items":{"type":"string"},"type":"array"}},"required":["freshness_state","holes_count","holes_ratio","inputs_hash","last_checked_at","matrix","staleness_reasons"],"type":"object"},"kind":{"enum":["architecture_context","test_architecture_context"]},"schema_version":{"minimum":1,"type":"integer"},"updated_at":{"type":["string","null"]}},"required":["schema_version","kind","agent","computed"],"title":"architecture_context","type":"object"}
