{"agent":{"boundaries":["src/pkg remains independent from infra/adapters"],"key_flows":["Request path -> handler -> storage"],"summary":{"detail":"This summary is composed from directory context artifacts only.","one_liner":"High-level architecture overview derived from directory ctx."}},"computed":{"freshness_state":"good","good_ratio":1.0,"holes_count":0,"holes_ratio":0.0,"inputs_hash":"hash_placeholder","last_checked_at":"2025-01-02T00:00:00Z","matrix":[{"ctx_kind":"dir_ctx","ctx_path":"src/pkg/__pkg__.dir.json","ctx_semantic_hash_sha256":"semantic_hash_placeholder","freshness_state":"fresh","subtree_hash_sha256":"subtree_hash_placeholder"}],"staleness_reasons":[]},"kind":"architecture_context","schema_version":1,"updated_at":"2025-01-02T00:00:00Z"}
